essay_id,essay,human_score
1113,"Click, click, click the mouse of a computer goes as you are searhcing throughout the internet. Computers are a great way to teach kids how to be social, make people more intellegent, and help you with your homework, I believe that computers have a very positivr effect on people. Computers can touch kids to be social because first off computers are like an online phone, you can talk to people in so many ways, facebook caht, aim(chat),, myspace, twitter, skype, and a lot of others ways that i havent mentioned. Also I think is a teen or kid or even adult that is too nervous to talk to people on the phone or in person, and is socialy not their or painfully shy can start of by just chatting with people online. Once they feels more comfoatable, then they can start talking to the person on the phone or in person. For example, I once @MONTH1 this girl who was very sweet, but was painfully shy and everyone for it, so one day she decided to make an aim nad talk to poeple on it, and provove that she isn'e a annoying wherd girl that everyone makes her out to be. She turned out to be one of the nicestly funniest person I ahve hung out with in a while. Which how internet can help you. HAve you ever felt that computers sometimes make you more intellegent? Well, in my opinion I think that computers help out so much more than a book. If you want information its just about typing some keys and a click of a button. Ahving a computer is like your own personal handbook of veerything in the world. A lot of people these days study from the internet, I know I sure do. Statistics show that @PERCENT1 more people say, that computers are more helpful than books and can make you a lot more intellegent, because the internet has so much more deatil than books, and mor efacts. @PERCENT2 of kids that have a computer use it for homewrok. Computers is a great tool to use while you are doing your homework. I spend most of the day on my computer doing homework than off it. For example, say you have a report and you need facts on @CAPS1 @PERSON1, and where he was born. You would jus type in, ""when was @ORGANIZATION1 boen."" and born! There it is with the date exactly. Also if you having a piece of writing like your rough draft so why spend the time trying to write really neat and perfect? When you can just open up a word document and type it up. To sum everything up computers have deffenatly a positive effect on people from these three reasons, computers are a great way to teach kids hohw to be social, make people more intellegent, and help you with your homework, But I understand where your coming from people are spending way to much time on their computer and less time exersising, but you can look up great ways to exersise on the internet and watch videos of people that have @CAPS2.V shows about exersising and do it with them on the computer. Remember, computers aren'@CAPS2 just a waste of time and way to will your brain cells. they have a very positive effect on you. ",10
1120,"Dear editor, I have heerd about me advance in technology dispute. I would like to say their I think it does benef it our society. I think this because: You can communicate with friends, they help you with school and a reliable resource for you need to find. Please read on so I can explain my reasons. Computers and technology benefit us in many ways. One of mom's they able you to talk to friends. Computers give you an easy and fast way to communicate with others. Instead of sending a boring letter that takes forever to get there, you can hook up with your friends, you haven't seen in a while. I remember when my friend moved to @LOCATION1. It would of taken me forever to there, so instead I went online and talked to him. Also, lastly, it less your hand. Now please read on for my second reason. My second reason . Computer are a of looking in many different take days. You can go online and find everyone, in ten minutes. In fifth grade I had to do this really hard project. I looked in books @NUM1 days and find. But then looked up everything I needed to known in an half hour. Lastly, they have more success. If you go on in @ORGANIZATION2 you could find hundreds of on one topic. Easy right? New read on for reason. My last and strongest reason that technology can help you find anything in everyday life. Computers can help you find your way. They supermarket for you. They can help with anything. One year I went on vacation to @LOCATION2. my mom move. So got lost help. Na, if we gotten difference have nevir pickel. Wouldn't you be more confident if you had ? Computers can a lso find for places for you an your friends or family to have fun like it couldn't find places never heard of. Such as @ORGANIZATION1. Now need on so can all up. So, as you can see technology, benefits our society in a big way. Mostly in these three reasons: You can communicate with your friends, they help you in school, and they are a reliable source for everybody life. i hope you have enjoyed rading this. Please take this info your next . thank you for your time, and thank you for reading my paper.",8
1136,"Dear Local Newspaper, @CAPS1 you know that more than half the students in the world use the computer to study. I think that people don't spend a lot of time on the computer. And even if they are it's for studying learning of catching up with old friends. Here are some reasons why I think that computers have good effects on people. Most kids use computers to learn about things they are doing in class. And they also use the computer to study about a country or a person they are doing a report on. Also there are games on the computer that can help you with math. Now onto my secod reason. You can also use the computer to send emails to friends that live faraway, and also you could use things like facebook to find friends that had moved away. And you could also use a video camera to video chat with a friend or if you are a business man or woman you could videochat with clients all across the country. Now onto my third and final reason. Computers also have applications like microsoft word which lets you type things such as essays or term papers instead of having to write them out by hand. Also there is an application that lets you make a powerpoint if you need to make one for a project. And there is an application that lets you paint pictures or draw pictures. Those are some reasons why I think that computers have good effects on people. If we didn't have computers the world would be very different like kids wouldn't be able to search things for projects or type essays. And you wouldn't be able to keep contact with someone who moved away. Also you wouldn't be able to make power points for projects. And that is why I think computers have a good effect on people.",8
1141,"Dear @CAPS1, More and more people use computers, but not everyone agrees that this benefits society. Those who support advances in technology belive that computers have a positive affect on people like me. They teach hand-eye coordination, give people the ability to learn about faraway places and people, they even allow people to talk online with other people. I will tell you why we should benifit these computers. The first reason is computers teach hand-eye coordination. You can learn how to type really fast. Without hand-eye cordinatoin how are you supose to hit a ball coming at you with a bat, how are you supose to catch a ball with your hands? The second reason is you can learn about far away places and people. Like how we are in the @LOCATION1 and we want to learn about @LOCATION3 or say that we are in france and we want to know about the german people are look it up we dont go all the way down there jest to see the german people we look it up. Now think about it you jest going to fly there and come back the same day. The last thing is you can talk online to anybody you want from africa to the us all the way to @LOCATION2. So you see computers are really speacial becus you see you dont want to write someone amillion things it is not right so we need computers.",6
1144,"Dear @LOCATION4 @ORGANIZATION2, Computers are a great invention but people are starting to dislike it. On the hand, I believe the computers put positive effects on people. First of all, they are a great way for kids to have fun: @CAPS1, people can learn very interesting facts. Lastly, it is a great way to communicate with friends and family. These are a few reasons I think computers put a positive effect on people. To begin with on a computer you can have a lot of fun by playing games. The computer saves money for a lot of us. For example, if you bought a game system it would cost well over @MONEY1 but on a computor you can find and play games for free. Not all games have to be like ""@CAPS2 of @CAPS3"" or ""@CAPS2 of @CAPS5"" they can be games about sports. Supose one student broke his leg and he love playing soccer. He could just on the computer and play a game of soccer even though he has a broken leg. People can @CAPS1 learn various facts right from their computers. The most important thing that computors are made for is to learn new things. No one in the @CAPS2 knows everything, but if every one put what they know into the computer than people can get learne any thing from them, I remember @CAPS6 my friend once told me about some guy named @PERSON2. I had no idea who he was so my friend started laughing at me, @CAPS6 I got home I searched him up and by the time I was done reading about him I knew more than my friend about @PERSON2. If he ever have a question in class and our teacher can't answer it he/she always tells us to either ""@CAPS7"" it or ""@CAPS8"" it. They both are search engines. Not only can you learn a lot from computers you can @CAPS1 communicate with people from different countries. What if @PERSON1 did not invent the telephone? How different would our life be me right now? Anyway most people use the computer to communicate nowadays. Whether it @CAPS9 or @CAPS10, or whether its @ORGANIZATION1 or @CAPS11 all are a great way to communicate with people. With tele phones it costs money to talk with people in a different country, but with the roputer it is absolutely freen. You could be living in @LOCATION1 and chatting with someone in @LOCATION5. You could live in @LOCATION2 and email someone in @LOCATION3. Communication every where is fast and easy with the computer. My whole family lives in @LOCATION6 and it costs us twice as much to make a call there. @CAPS6 we use the computer it is even better because they can even see our fare throught the webcam. As you can see, computers are not negitive at all for all I know is that help people around the @CAPS2. They help kids have fun with the games we can play. @CAPS1, it teaches children and adults various now things. Lastly, it is a great communication strategy. I hope that you put those reasons in our local paper so every one can see how computers have a positive effect on people.",11
1150,"Dear The @CAPS1 @CAPS2 @CAPS3, Computers are a great piece of technology. Computers are great for many reasons. Three of these reasons are pleasure, convienience, and education. I believe that these three reasons are the main reason we use computers today. One reason we use computers is for pleasure. On certain websites, you can talk to friends, see what your friends are doing, you can even video chat with them. Also, you can watch movies, @CAPS4 episodes, and videos. In addition, you can listen to music, play games, and check sports scores. I strongly beleive that pleasure is one of the main reasons we use computers today. Another reason why we use computers is convienience. Most people in @LOCATION1 have a computer in their home. Computers are convienient because you pay bills on the internet. You email co-workers about jobs. In addition, computers can help people create websites so their their buisness is more noticeable. As you can see, computers are a very convienient piece of technology. The final reason why we use computers is education. On a computer, you can learn just about anything. You can learn about @CAPS5 history, sports, you can learn about current events in the world. Computers can help you study, take notes, and helps do your homework. When I have a project, I always use the computer to find important information about the topic. As you can see, education is the most important reason why we use computers. Now, I think you understand how computers are important in @LOCATION1's education, pleasure and convienience. I hope you listened to my opinion on computers and I also hope you continue to tell people how great and important computers are.",8
1172,"More and more people use computers, but not everyone agrees that this benefits society. I feel that those people that think computers do not benefit society, are right. I feel this way because people need to start exercising it more, and interact with family and friends. Also, should enjoy life. Please read on to read in detail, as to why I feel this way. Firstly, those who are always on the computer need to exercise more, they need to exercise to stay healthy and strong. If they don't, they will most likely eat more and gain a lot of unwanted fat. Also, some of them don't even exercise at all. Secondly, they don't interact with their family and friends as much. Those people tend to probably argue with their family because they had to get off of computer. When you fight with people you want to gey away from it so you go back to the computer. It's not healthy to be on the computer for long periods at a time. Lastly, they should enjoy life. See the world through their own eyes. Party with friends and family. Go to college and do something with their lives. They need to enjoy things how they originally were without any computers, ipods, or even cellphones. In conclusion, the reasons I feel this why are because people need to exercise more, and interact with family and friends. Also, they need to enjoy life. I hope you understand as to why I feel this way.",7
1173,"Dear @CAPS1, I believe that computers are benefitual to society. This because computers do tasks such as helps research, communicating with others, and has fun games and websites. Computers are really great sources for whatever you trying to do. Honestly, a @CAPS2 without computers I wouldn't know what to do. Computers are like digital encyclopedias, which has just about all the information your looking for. Computers have databases or websites design to have with research just as the do. Say that you have a essay due tommorrow and you need quick and valid information you can simple go to @CAPS2 @CAPS3 @CAPS4 which is a computer database. Your end up with saild facts to help with your final draft. So, you wouldn't have to go that far to research. Communicating is something else the computer helps with. For example email and @ORGANIZATION1 is a way to communicate. Email is where you can send a message and a wait a reply while on the other hand @ORGANIZATION1 @ORGANIZATION1 is where you get @ORGANIZATION1 replys. The latest thing in the communicating @CAPS2 is video chating. This where the person your chatting with can hear and see exactly what your doing. This is useful for families who life a good distance from each other. Computers play many roles and being used for fun is one. the @CAPS5 has many fun gaming websites such as @CAPS6.com miniclips.com, and @LOCATION1. This websites help take your mind off a bad day. You can also buy computer games for your computer. A very popular game is The @CAPS7. This game is base around your charater and the life you chose for it to live this game can take you to mother place where all your stress just fade away. So, computers betters society in many different ways. A few include research, communication, and to have fun. The computer is a very enhanced tool to enrich ones life. Computers take on difficult tasks and usually succed. So, computers are truely one thing we need.",8
1208,"I disaree with computers are for you becau if one you don't do nothing this you can meee bad people three you can in samething bad. So if you want to know what happen next you will have to keep reading on. Reason are you do nothing because people need to now and because evebady have to lost thing son thing. But if you keep doing nothing ever day your bady will all used to doing fun you can't move or walk. Reason two you can meet dad on the computer becauce people can not tell you all the thing you want to know and they can be doing thing that not ok and they can be want by they can be filters. Reason three you can all in something bad becauce you can be takeing to you and you say something about your self and they are about something hav and you don't know they use you for something you don't know now tell someone can to you and say you all in why but they tell you so being on the computer far a long time can get you in something big. You don't do nothing, you can had really now you can in something bad. Now you know why being on the computer far along time can be bad. Now what will you why you that side. P.S. thin I you for taking so are time reading this.",7
1212,"Dear Local Newspaper, @CAPS1 home computers is a good thing for many reasons. One reason is because people can use computers to learn about other countries and people. People can also use computers to type and save paper. Also, people can use computers to talk to people living close or far away from you. Finally, computers can save paper by replacing books. One @MONEY1 the most important reasons why people need computers is because computers can help you learn about and research other things going on in the world. If a student needs to research a country and write a paper about it for school, it is much easier and faster to use a computer than to look through a textbook.Computers are also better and faster than a textbook if you want to know more about a person or a culture. Using computers to type are also faster than writing a paper. Using a computer can save time and money when it comes to typing a paper. When you are typing a paper, you don't have to worry about @CAPS1 handwriting or breaking your pencil. You also don't have to worry abut spelling something wrong because computers can check you spelling and grammar. What you are writting a paper you have in about all @MONEY1 these problems and more. You also have to spend money on pencils and other writting suppplies. Computers also saved people @MONEY1 becase they didn't need to buy paper to make textbooks. Computers also evolved how people can communicate with each other. Before computers were invented, you couldn't talk to people in other countries unless you paid to use a phone or sent them mail. Now, you can send instant mail which saves days @MONEY1 time and paper. You can also use webcams to talk to family members and people you don't know. That can save you a lot @MONEY1 money because you don't have to pay money for postage stamps, phone calls, or plane rides to visit them. Those are some @MONEY1 the best reasons why @CAPS1 a home computer is better than not @CAPS1 one. A home computer can save you time when you want to research a country, person, or culture. They can save you money because you don't have to buy postage stamps, pay for phone calls, or pay for plane rides to visit someone from a different state or country. Computers also help save paper because you no longer need to make large textbooks or use a different price @MONEY1 paper when you make a writting mistake.",9
1264,"Dear @CAPS1 @CAPS2, Computers do not have a positive effect on people. Thanks to computers people arnt being active as much, enjoying nature, or interacting with family and friends. One reason this is true is because people are not exercising, they're too busy playing on the computers. People are gaining weight, which is already a problem in the @LOCATION1 because of unnecissary technology. There are plenty of sports that could be done, such as soccer, baseball, football, and so many more. People seemed to manage fine without computers and were a lot more active before them. Another reason computers don't have a positive effect on people is because they don't go out and enjoy nature. People spend too much time looking up beautiful place and animals when they could easily go explore around outside! Take a walk by the forest or in a local park, even by the beach and you'll see loads of animals. Not to mention, the immense amount of different plants and flowers they have never noticed right behind their very own home! No computers and people could quickly start enjoying nature more often. Thirdly, a reason why computers arn't positive on people is because they're not interacting with other people. Some people are too busy on facebook or myspace, e-mailing or @CAPS3-ing each other. Sometimes they arn't even talking to who they believed they were, it not only dangerous but unhealthy also. Whats wrong with giving someone far away a call? You can actually hear their voice and know its them on the other line! Its rediculous how people will e-mail a friend thats down the street. It would be much simpler and healthier to just walk over to their house. The two of you can chat and take a walk, or play a game, not just sit infront of a screen the whole day. Computers make interacting with other people, in person, a lot more difficult. With computers people are not active enough, don't enjoy nature often, or interact with others as much. They simply are not a positive effect on people. You should also agree and let computers stay to perfessionals.",9
1270,"Dear Local Newspaper, I believe that computers have a coolest effect on people. It allows people to develop hand-eye coordination, allow people to learn about faraway people and cultures, and communicate online through e-mail or instant messaging. All of these reasons prove to be a positive reason to use the computer. You will need computer skills in various jobs and what better to start than now. Hand-eye coordination is a and in life. You need the in jobs, and in to days @CAPS1 the for that gets In the quarter mile must be able to find his and on in an office you have to watch as typing. you to watch popular with today. @CAPS6, @CAPS2, and @CAPS3 are only a few of many websites were people can communicate through instant messaging or e-mail. All of these sites allow you to find family members, friends, and many more. You can in with a friend that is out of state, or you can talk with a person out of this country! Many people do this in their spare time to try and set up a reunion with people that you know in middle school through college. Tons of these people have not seen were @NUM1. So as you can see contacting people through internet is by many people in our world today. So as you can see I support the use of computers, and I feel they are critical to peoples daily lives. Whether they are building hand-eye coordination, researching a country, or contacting family and friends through @CAPS3, @CAPS2, @CAPS6 the internet is highly valued and I hope you feel the same way.",10
1277,"Dear @CAPS1 @CAPS2, I am writing you this letter to inform you that computers do benefit society. Computers benefit society because we can learn about places we want to go. It also benefits society because in a couple years everything will be computers. However, computers benefit society because they @MONTH1 life easier now a days. My opinion is that computers do benefit society. Computers help everyone a lot. First, we can learn about the places we want to go to. We want to learn about the places so we can travel there. However, when we know a lot about that place we might want to but our plane tickets threw the computer site then after you get the plane tickets you can go and discover the places/place. Second, in a couple years everything will be computers. However, @CAPS3 will be threw a computer site (world wide web). We will get our education online. There will be games online. Computers do benefit society. Lastly, computers make life easier. They make life easier because instead of picking up a phone to call your friends or family you can go online to talk, they also make life easier beacuse instead of going to your family or friends house you can go on to aim or what ever chat site you got and chat threw instant messaging. In conclusion, computers do benefit society. First, you can learn about places you want to go to. Second, everything will be threw computers in a couple years. Lastly, computers make life easier.",7
