essay_id,essay,human_score
801,"Dear Newspaper people, @CAPS1 you might heard on the @ORGANIZATION1 new, more and more people thing computers are the benefits of society. I personally agree with them. I think that theyare making people missing out of new things, missing out of meeting new people, and looking out on exercize. Time flys by fast. Things can fly over your head and you might not notice them. Have you ever ben on a computer for an hour. It might have felt you were on for @NUM1 minets. Many people ben on it for a hole day. You could of missed a year of stuff. New things like the new ipod nano with camra be invend and you would of not known. Also, the ipod. You could down load books andd read them on there. There also new things to try like jumping art of a plain or bungy jumpimg. You could be going to new place around the world. Traveling to @LOCATION1, @LOCATION2 or even under water. Even going to @LOCATION2 and having a melting, warm, right of the oven tayst cheese pizza. My mouth is grulling for just thinking about it. How many people do you know. What about on facebook or myspace. @CAPS3 not you should go to the park. Meet some people. Just going to a family house, you can be interacting. Everyone should be interacting with someone. Even two year olds need to interact with other two year olds. Thats they learn how to share @CAPS2, your not two anymore but its good to know someone. Learning how others think too. You @MONTH1 think your way in good and the other erson way is not. Thats called interacting talking about it. @CAPS1 you might see on news how many familys have someone in the familys having weight problems. Meny shows like biggest losers @CAPS3 it chanels are trying to help these people lose weight. But what cams this? It could be not eating right, or not excresing right. But the problem could do with computers. Many people are spending @NUM2 mins on the computer, than @NUM3 excersising. Just a quick walk around the lock can make you lose at leat @NUM4 callories. Other might rather stay on the computer and gain @NUM4 callories. And some deaths are around by a heart attack. This @MONTH1 caused by plack billed up or weight going. In sted of reaching for an apple many americans reach for that foods. I think we should still use computers but cut down the rtimes we use it and exercise and eat more. You might think after reading this letter. Thinking people wont lisen about excersing and meeting new people or palces. But, the one thing we can do is to at least insire one person. That person can inspire another person. This can go on and on. Little by little we can help people what they can do with out using an computer.",9
827,I think computers have a postitive affect on people. Computers are very important to society. You can still interact with Your Family and friends either in @CAPS1 chat or @CAPS2. Computer are also helpful for applying for @CAPS3 like you can look for @CAPS3 you like. You can do @CAPS5 exciseses and useful for @CAPS5 essays. If you have a laptop you can bring it anywhere you want you don't have connect anything it take wireless and you can connect to the @CAPS6. You can look up stuff on the @CAPS6 for your homework and other stuff. Buy things without having to go to the store. These are reasons why computers have a postitive affect on people.,6
849,"Dear, Local @ORGANIZATION1 paper I do think that computers benefit society, because if a student needs to write a report europe their going to weell. A computer to give the quier accesible information is do there project at home. Computers are great ways to meet people online so that you stay social and not. They also teach hand-eye-cordination. So you eyes are beter their seeing nothing. I also think computer benifits society because it could get student motivated in passing there test or passing the school year and getting the to use it. Computers are also a great of knowledge and can get kids to be better on a subject like history, or science, you should agree with me because local @ORGANIZATION1 papers got there information off the internet sometimes and with our computers @ORGANIZATION1 would be slow and. Computers also have positive effects on people because it teaches them the dangers of things and they could be more and, and computers give finger strongly gripto be a lot faster, and computers are the fastes way to know about the @ORGANIZATION1 or about the wether, like if there wits going to be a snow storm you could check if you got school.",7
860,"Dear @CAPS1, More and more people do use computers, but it is not a bad thing. Student come home from school tired, bored, and doesn't want to go outside and exercise. Students would rather go on the computer. When students go on the computer they can chat thier friends, listen to music, or learn about distant places. Firstly, students would chat their friends on the computer. When it is winter, students can't go outside and exercise. Students can grab their laptop, and go on their warm and comfortable table bed to chat friends. Maybe a friend can help with homework. Going outside in the winter can make students sick and miss days of school. Secondly, students like to listen to music. Music is an important part to a student because music lyrics can express themselves. Students @MONTH1 be dancing to their favorite song. Dancing is exercise and adults do say we need more exercise. Also students can play very soft music than not doing homework at all. Thirdly, students can learn about distant places. When I am on the computer I type in www.google.com and want to learn about a place where I want sto visit other student might want to learn about places they've never visited. Italy, france, @LOCATION1, and much more places people would want to visit. They would want to learn about places before ever go. In conclusion @CAPS1, more and more people go on the computer, but it does not have to be a bad thing. Yes, students should go exercise but all the time. When students go on the computer they can chat with friends. Secondly, students can listen to music. Thirdly, they can learn about distant places. @CAPS1, it is not a bad thing that students go on the computer.",8
872,"Dear @CAPS1 or @CAPS2 The purpose of this letter is about how computers have changed our lives for the better. They have improved our society. Changed our way of life and have made things easier. I am a firm beliver that computer were one of the greatest invention of all time. Computers have had a very vital and positive impact on society. For example, education has vastly expanded since the computer. Both teachers and students have benefited. Students can now search the intrenet and learn about different places, things in history, how to read and write bette, etc. Also computers have been a major part in entertainment. From reading online news to watching movies and listening to music computers entertain all of us. And computers help us connect with friends and even meet new people. Aside from that computers make life easier. People can get degrees from learning online learn another. Research as also easier than is to computers you can just about anything than to computers. Some people say computers stop people acting with family but infact facebook you can still. Computer have also ourlives. From helping small buiness thrive by making it easier to make and recieve orders to help spread information globaly computers make this all possible. As I have shown computers have benefited society and have had a positive effect on human beings from educating individuals to staying in touch with relitives, computers have made their mark on improving the way we live. I hope this letter will help show you that computers are a necesary part of the twenty first century.",8
896,"Dear local Newspaper, This is a letter about how I feel about the effects of computers. I think computers are great you can, interact with family and friends, learn about things going on around the world, and it could help you with school work. First I would like to say that you can interact with family and friends. You can just go on facebook, @CAPS1, or,myspace and talk, send pics, and comment on other peoples things. There are many groups you can join too, wich allows you to talk to other people and meet new friends. You can also interact with your family if they have a facebook or @CAPS1. The second reason why computers are not bad is because that there are many websites that you can find different information like science, math, history and all that kind of stuff. There are alot of different topics you can learn. You can find information from the weather to where your family history comes from. My last reasoning for thinking this way is that many kids do their homework on computers and if people are saying that computers are bad than the parents are not going to allow them to use the computer for educational purposes like homework and projects. There are many other reason why computers have a positive effects of people. But interacting with family and friends, learning about things around the world and your education depends on computers.",8
929,"Dear @CAPS1, I believe computers are a huge benefit to society. I myself have a computer; it is very important and useful to me. Over @PERCENT1 of the families in our town own at least one computer. Computers are a great source of information. They also allow you to talk to people, even if they are far away. They are also very convenient and easy to use, in mu opinion. Based on these positives, @CAPS3't you agree with my opinion? Computers are a great source of information. Unlike books, which you must find and buy, there is an enormous amount of information just a mouse click away! With computers, you can learn about far away places and people without having to visit or talk to them. Let me compare this to a book. Let's say you wanted to do research on @PERSON1. You would have to go to the library and search for a book about him. And what would you do if you couldn't find one about him? With a computers you could type ""@CAPS2 of @PERSON1"" into a search engine and receive of information in under a minute! I love saving time, and computers help me do that. They also augment the information I use. Another astounding development in computer technology is that you can talk to other, no matter where their location is. Email is extremely faster than writing a letter. having to pay to travel. Who @CAPS3't like that? Computers are very convenient. You can surf the internet, talk to people, and much more from the comfort of your bedroom. There are jobs that you can do from home on a computer. No need to go anywhere to work. My uncle is one of those people. He is s stockbroker, and operates his whole job from the computer in his house. It is a convenient and a well-paying job. I asked him what he thought of his job. He said, ""I love my job because I can work when I want to work, and from the comfort of my home."" @CAPS3't you want to have his job? I would most definately. In conclusion, computers are very beneficial to us. Did you know computers were first invented by @ORGANIZATION1 to perform calculations that were very long? Look at what they have involved into @DATE1. They bring us information at amazing speeds. They let us talk to people all over the world. They are very convenient. These are major benefits to society, and everybody should embrace computers.",10
946,"According to the @ORGANIZATION1 govermant @PERCENT1 of @CAPS1 spend @NUM1 hours or more on a computer a day. A study shows @CAPS1 are't getting enough exercise, aren't spending enough time with fmaily, aren't enjoying their lives. Right now people would rather be on the computer then doing other stuff.Since more people have been using the computer those people heven't enough exercise. Now @PERCENT2 of @CAPS1 have gone obese since they have always been or the computers, @CAPS4 year a @CAPS6 was fit and healthy, but when a friend told him about a website within the @CAPS5 @NUM2 minutes. After @NUM1 months, the fit and healthy @CAPS6 became obese. The @CAPS6 would always have junk food when @CAPS7 was on the computer. when @DATE1 came, @CAPS7 tryed out for his school baseball team. @CAPS7 didn't make it because @CAPS7 was out of shape. After that happened, @CAPS7 went to his old ways by eating healthy and exercising. Now that @CAPS6 is in shape for any sport @CAPS7 plays. Next people aren't spending enough time with their families. A lot of jobs require people to be on the computer. When that happens a person will forget whats really important to them. A couple years ago, a @CAPS6 was going to have the biggest game of his life. It was the championship game. @CAPS7 was reminding his dad about it all. When the gone was about to start, the @CAPS6 looked into the crowd for his dad. @CAPS7 didn't see him at all. The @CAPS6 was just think his dad was. after the @CAPS5, @CAPS7 looked again, but now @CAPS7 was sad. His own dad wasn't at the game. His team @CAPS4 the game. Now his dad doesn't miss a thing since @CAPS7 doesn't go on the computer as often. Finally, people aren't enjoying their lives they would rather be on a computer than doing stuff they like. One @CAPS6 used to always play basketball with his friends when @CAPS7 started to go on the computers, everything changed people would ask him to play, but @CAPS7 would say no. The computer was the only things that mattered. When the @CAPS6 tryed out for his @CAPS8 school @CAPS7 didn't make it because @CAPS7 forgot how to play. When that happened, @CAPS7 stopped using the computer and went back to basketball. now when @CAPS7 tries out., @CAPS7 makes. It's now or never to decide either waste your life on a computer or live your life. I would rather live life than be on a computer.",8
955,"I walked outside to get the mail and newspaper. I saw the front page talking about computer. An article said, too much computer using. I though there wasn't going to sell more computer but, it said that people are using computers and are not exercising much. I think that people are not going to have a hard time quitting to use their computer. I had a friend that didn't know how to use the computer. He past his hour playing outside. In the @DATE1 he tries out for @CAPS1 baseball. He is a very good athlete. He does grate in school too. Others people without a gob are not looking for something 'to do they are at the computer everyday. When they should be doing work around and inside the house. Peoples with computers shouldn't be all day like these friend my friend haves is using his computer everytime he comes from school. He don't do his homework on time. Every time he doesn't want to go out and exercise his mind or get a little bit of sun he sometimes don't eat so he should give his brain a rest and do physical things that will help them. Other person such as the computer workers should write a note to people with computer saying how computer can be addicted to people and maybe realize how much often they should use their computer and was using it to go to get information and to collage. She started to use the computer to chat with people and ended up using the computer a lot and not going to collage. I believe that computers are an major impact on people. People should be going about to have fun get sunlight not staying at the computer all the time. Many adults don't use the computer is most the teens and kids. People should go to the gym and build strong muscles. They should stay away from computer for a time. Agains computer would be the right thing to do.",8
991,"@ORGANIZATION1, @CAPS1 my name is @PERSON1 and I am writing to you because, I want to inform you about the benefits of having computers. I think that having computers is a great way for kids like me to learn more about things in the world. Having a computer also helps people in need and also inform people about far away places in the the world. I beleive if it wasn't for computers we wouldn't really know that much about our world. Computers also help us to send emergency messages across the world in @NUM1. Some people do not think that computers have an effect onour society but I for one think computers have a very positive effect on people. people also think that computers make people spend less time exercising, but I believe that it actually helps people to exercise because you can go gives different exercising techniques. In conclusion, I think that computers have a positive effect on society.",6
1037,"Dear editor of @ORGANIZATION1, I am writting this letter to you @CAPS4 I think people are not getting enogh exercise @CAPS4 they spend so much time on the computer and they are going to websites here are some things that I want you to write about so people can and @MONTH1 be aware. My first reason I exercise why this @CAPS4 so many people spent so much time on the computer they don't get they don't walk. They sit and want message their frends @CAPS1 day. Not worrying that they are ganning @CAPS2 and @CAPS3 A on their heart @CAPS4 of the @CAPS2. @CAPS4 of this it can @CAPS5 to heath @CAPS6 things could you can't do @CAPS15. m @CAPS7 reason @CAPS8 @CAPS9 websites to moral kids @CAPS10 @CAPS11 things they Are not suppose see when kids have free @CAPS12 computer excise the thing wen let me @CAPS11 this can @CAPS10 @CAPS11 @CAPS14 sites, gunsites, @CAPS15 to a things can make something they @MONTH1 really hurt someone or maybe even themselves. Kids try to learn @CAPS15 people talk like @CAPS16 websites things that they are not able to and over they can see Are @NUM1 on @CAPS16 @CAPS18. My third reason chat sites Places to get some attension They will @ORGANIZATION1 things they are not suppose to the @NUM2 year oldd man here some things to write are doing and please monitor them as much as you can to prevent this.",8
1087,"You say that computers are bad on todays society? @CAPS1 I'm here to prove you wrong and tell you that they can actually benefit todays society. Maybe some kids don't have phones, so they can go log onto facebook and do everything a phone has to offer and more. School. School. School; so many homework assignments and projects are assigned, and using computer programs help alot and give that proffesional touch. And how coud you forget 'google' the most famous online system, that everyone loves you can do just about anything with that page. So computers bad for society, think again and listen closely. blc computers have just benifited us more than ever. www.facebook.com, that is one of the most visited pages on the internet for all different ages, it deffinetly benefits you. Logging on and seeing your friends profile's newest updates on pictures, videos and life, you get every little detail using facebook. And I you don't have a phone, no. wornes, facebook has a chat system, so you and friends and relatives can talk, or maybe theirs a family party comingup you can get inboxed on all the information, and visit the relatives homepage and see how theyve been doing. @CAPS3 you haven't logged into facebook yet, you deffinetly will now! ""This project will be done on the computer,"" how many times do you hear a teacher says that, almost everytime youre given an assignement! @CAPS1 windows and @ORGANIZATION1 programs will really benefit you in your need for school help. Lets say you've been assigned a project to create a product commerical in computer class, you can hop right onto windows movie maker and get all the help you need, and you'll have the ability to create you project right on the program so it looks and sounds professional. One program you can always use throughout life for presentation is 'power ', In my history class we were assigned a famous person from the @DATE1's and were to do a presentation; @CAPS1 when I got my assignment I went right to powerpoint and got a great grade! lastly the known, @ORGANIZATION1 word! used for all kinds of projects or homeworks and espically writing papers or short stories, having spell check, youre garenteed a good grade! Google! Everyone knows it and everyone loves it. This web hit canbe used for just about anything. From searching pictures and information for a school projects, watching videos of songs, friends, or tv shows that you love or wonna check up on. to looking at websites. Some say the @CAPS2 holds people from exersising, but google can shows you videos of special work outs or websites on healthy eating or an on exercise group or fitness club, so now you see the internet benefits us tremendously! ""Have you change your mind? have you listened closely?"" @CAPS3 so your life just become a whole lot easier, by using facebook, for social ability, @ORGANIZATION1 and windows programs for school, and google for life and health, you have just benefitted from my writing and from using modern technology, the computer!",11
1111,"Being a teen myself, my computer is something I don't think I would be able to live without. But is it holding me back from more important things? I think so. I feel that not having computers will in a way educate people more so than now. For example with school research papers we imediatly go to the computers in order to find information when we could be using books and magazeens. With having the use of computers many people don't properly know how to use and find information in books. Also being around computers and using them so much is pulling families further apart and stopping humans from being more interactive with nature and the environment. For many people using a computer is a life style, it's something we tend to use more than religiously and that @MONTH1 not be the best thing. Children, teens and even adults get extremly addicted to computers. Teens and children use laptops and @CAPS1's everyday in order to do their school work, and to talk with friends. As well as parents/adults, they use it to get their work done and use it as a easy communication with co-workers. To this very day people have become very addicted to computers. I know for certain that in my family, my mother, nor my father, nor my brother, nor I could go through a day without using a computer. As I mentioned before computers are also pulling families further apart. There is less family time and comunication between family members these days, due to computers. Insead of spending time with the family, teens prefer spending time on the computer chatting with their friends. I bet if there was a poll was taken on how much family time has been taken away in households because of computers I almost garentee it would be quite a large amount. I know the only true family time some families have without computers is dinner and that isn't much. Lastly many humans are not as connected to nature and as involved as they used to be. Using computer keeps people inside and not exposed to nature. Though there many advertisements and pop ups on the computer that inform us about how to take care of the earth properly, we so easily ignore them and remain playing on the computer than going outside and doing something to help make the world a better, clearer place. Not only is it just taking care of our earth, but it is also the fact that not many people these days go out and get the fresh air they need as much as they really should. Most likely not all of that is due to the use of computers, but I bet a great deal of it is. Like I said before it is super hard to imagine a day without a computer, I mean how would we communicate or do our work? But there are trulthfully other ways to do them that we just aren't very used to because of the fact that we are so attatched to them. I never really noticed till now that it is possible to live without a computer, and that so many people are missing increadable things such as family and nature because we are so addicted to the computers.",11
